"Tabela 9558 - Domicílios, por situação de segurança alimentar existente no domicílio, faixas de rendimento mensal domiciliar per capita e situação do domicílio"
"Variável - Domicílios"
"";"Situação do domicílio";"Ano x Situação de segurança alimentar existente no domicílio x Faixas de rendimento mensal domiciliar per capita"
"";"Situação do domicílio";"2023";;;;;;;;;;;;;;;;;;;;;;;;;;;;;;;;;;;;;;;;"2024"
"";"Situação do domicílio";"Com segurança alimentar";;;;;;;;;;"Com insegurança alimentar";;;;;;;;;;"Com insegurança alimentar leve";;;;;;;;;;"Com insegurança alimentar moderada ou grave";;;;;;;;;;"Com segurança alimentar";;;;;;;;;;"Com insegurança alimentar";;;;;;;;;;"Com insegurança alimentar leve";;;;;;;;;;"Com insegurança alimentar moderada ou grave"
"";"Situação do domicílio";"Até ¼ salário mínimo";;"Mais de 1/4 a 1/2 do salário mínimo";;"Mais de 1/2 a 1 salário mínimo";;"Mais de 1 a 2 salários mínimos";;"Mais de 2 salários mínimos";;"Até ¼ salário mínimo";;"Mais de 1/4 a 1/2 do salário mínimo";;"Mais de 1/2 a 1 salário mínimo";;"Mais de 1 a 2 salários mínimos";;"Mais de 2 salários mínimos";;"Até ¼ salário mínimo";;"Mais de 1/4 a 1/2 do salário mínimo";;"Mais de 1/2 a 1 salário mínimo";;"Mais de 1 a 2 salários mínimos";;"Mais de 2 salários mínimos";;"Até ¼ salário mínimo";;"Mais de 1/4 a 1/2 do salário mínimo";;"Mais de 1/2 a 1 salário mínimo";;"Mais de 1 a 2 salários mínimos";;"Mais de 2 salários mínimos";;"Até ¼ salário mínimo";;"Mais de 1/4 a 1/2 do salário mínimo";;"Mais de 1/2 a 1 salário mínimo";;"Mais de 1 a 2 salários mínimos";;"Mais de 2 salários mínimos";;"Até ¼ salário mínimo";;"Mais de 1/4 a 1/2 do salário mínimo";;"Mais de 1/2 a 1 salário mínimo";;"Mais de 1 a 2 salários mínimos";;"Mais de 2 salários mínimos";;"Até ¼ salário mínimo";;"Mais de 1/4 a 1/2 do salário mínimo";;"Mais de 1/2 a 1 salário mínimo";;"Mais de 1 a 2 salários mínimos";;"Mais de 2 salários mínimos";;"Até ¼ salário mínimo";;"Mais de 1/4 a 1/2 do salário mínimo";;"Mais de 1/2 a 1 salário mínimo";;"Mais de 1 a 2 salários mínimos";;"Mais de 2 salários mínimos"
"Brasil";"Urbana";"2081";"Mil unidades";"4074";"Mil unidades";"11384";"Mil unidades";"17534";"Mil unidades";"14270";"Mil unidades";"2719";"Mil unidades";"4124";"Mil unidades";"5787";"Mil unidades";"4158";"Mil unidades";"1135";"Mil unidades";"1394";"Mil unidades";"2560";"Mil unidades";"4026";"Mil unidades";"2959";"Mil unidades";"957";"Mil unidades";"1325";"Mil unidades";"1564";"Mil unidades";"1761";"Mil unidades";"1199";"Mil unidades";"178";"Mil unidades";"1945";"Mil unidades";"3440";"Mil unidades";"10944";"Mil unidades";"19893";"Mil unidades";"16968";"Mil unidades";"1906";"Mil unidades";"3177";"Mil unidades";"5143";"Mil unidades";"4523";"Mil unidades";"1350";"Mil unidades";"1027";"Mil unidades";"2031";"Mil unidades";"3609";"Mil unidades";"3211";"Mil unidades";"1127";"Mil unidades";"878";"Mil unidades";"1146";"Mil unidades";"1534";"Mil unidades";"1312";"Mil unidades";"223";"Mil unidades"
"Brasil";"Rural";"684";"Mil unidades";"1098";"Mil unidades";"1839";"Mil unidades";"1901";"Mil unidades";"608";"Mil unidades";"895";"Mil unidades";"994";"Mil unidades";"861";"Mil unidades";"419";"Mil unidades";"48";"Mil unidades";"486";"Mil unidades";"624";"Mil unidades";"586";"Mil unidades";"294";"Mil unidades";"39";"Mil unidades";"409";"Mil unidades";"370";"Mil unidades";"275";"Mil unidades";"125";"Mil unidades";"9";"Mil unidades";"538";"Mil unidades";"958";"Mil unidades";"1761";"Mil unidades";"2157";"Mil unidades";"719";"Mil unidades";"620";"Mil unidades";"820";"Mil unidades";"814";"Mil unidades";"490";"Mil unidades";"55";"Mil unidades";"352";"Mil unidades";"536";"Mil unidades";"562";"Mil unidades";"328";"Mil unidades";"43";"Mil unidades";"269";"Mil unidades";"283";"Mil unidades";"251";"Mil unidades";"162";"Mil unidades";"12";"Mil unidades"
"Fonte: IBGE - Pesquisa Nacional por Amostra de Domicílios Contínua Anual - 4º trimestre."

"Notas"
"Considera-se domicílio em situação de insegurança alimentar aquele em que seus moradores, nos últimos três meses,  passaram por ao menos uma das seguintes situações: tiveram a preocupação de que os alimentos acabassem antes de poderem comprar ou receber mais comida, lhes faltaram alimentos antes que tivessem dinheiro para comprar mais comida, ficaram sem dinheiro para terem uma alimentação saudável e variada, e comeram apenas alguns poucos tipos de alimentos que ainda tinham por que o dinheiro acabou. A insegurança alimentar pode ser classificada como leve, moderada ou grave, de acordo com a restrição na qualidade e na quantidade de alimentos consumidos pelos moradores.
Exclusive as pessoas cuja condição no domicílio era ""Pensionista"", ""Empregado doméstico"" ou ""Parente de empregado doméstico"".
O rendimento real é obtido conforme deflacionamento especificado nas Notas Técnicas da PNAD Contínua.
Na composição do rendimento domiciliar per capita, o rendimento de trabalho habitualmente recebido por mês é captado somente para pessoas de 14 anos ou mais de idade.
A partir de 2025, as estimativas deste tema passaram a ser divulgadas com base na nova ponderação da pesquisa, conforme a Nota Técnica 02/2025. Consequentemente, a série histórica dos indicadores foi atualizada."
""
"Legenda"
"Símbolo";"Significado"
"-";"Zero absoluto, não resultante de um cálculo ou arredondamento.
Ex: Em determinado município não existem pessoas de 14 anos de idade sem instrução."
"0";"Zero resultante de um cálculo ou arredondamento.
Ex: A inflação do feijão em determinada Região Metropolitana foi 0.
Determinado município produziu 400 kg de sementes de girassol e os dados da tabela são expressos em toneladas."
"X";"Valor inibido para não identificar o informante.
Ex: Determinado município só possui uma empresa produtora de cimento, logo o valor de sua produção deve ser inibido."
"..";"Valor não se aplica.
Ex: Não se pode obter o total da produção agrícola em determinado município quando os produtos agrícolas são contabilizados com unidades de medida distintas."
"...";"Valor não disponível.
Ex: A produção de feijão em determinado município não foi pesquisada ou determinado município não existia no ano da pesquisa."
"A a Z
(exceto X)";"Significa uma faixa de valores. Varia em função da tabela (se for o caso).
Ex: O nível de precisão da produção estimada de combustíveis está na faixa A (95 a 100%)"
